Sheet: Intercomparison
A1: AREAL
B2: Total Area of Surface Lowering (m²) | F2: Total Area of Surface Raising (m²) | J2: Total Area of Detectable Change (m²) | L2: Total Area of Interest (m²) | M2: AOI % with Detectable Change
B3: Raw | C3: Thresholded | E3: % of Total | F3: Raw | G3: Thresholded | I3: % of Total | J3: Thresholded | K3: % of Total
A4: Channel Filling | B4: 5 | C4: 1 | E4: =RC[-2]/R5C[-2] -> 1 | F4: 253 | G4: 180 | I4: =RC[-2]/R5C[-2] -> 1 | J4: =SUM(RC[-7],RC[-3]) -> 181 | K4: =RC[-1]/R5C10 -> 1 | L4: =SUM(RC[-10],RC[-6]) -> 258 | M4: =RC[-3]/RC[-1] -> 0.70155038759689925
A5: Total of All Compared | B5: =SUM(R[-1]C:R[-1]C) -> 5 | C5: =SUM(R[-1]C:R[-1]C) -> 1 | E5: =SUM(R[-1]C:R[-1]C) -> 1 | F5: =SUM(R[-1]C:R[-1]C) -> 253 | G5: =SUM(R[-1]C:R[-1]C) -> 180 | I5: =SUM(R[-1]C:R[-1]C) -> 1 | J5: =SUM(R[-1]C:R[-1]C) -> 181 | K5: =SUM(R[-1]C:R[-1]C) -> 1 | L5: =SUM(R[-1]C:R[-1]C) -> 258
A6: VOLUMETRIC
B7: Total Volume of Surface Lowering (m³) | F7: Total Volume of Surface Raising (m³) | J7: Total Volume of Difference (m³) | N7: Total Net Volume Difference (m³)
B8: Raw | C8: Thresholded | D8: Error | E8: % of Total | F8: Raw | G8: Thresholded | H8: Error | I8: % of Total | J8: Raw | K8: Thresholded | L8: Error | M8: % of Total | N8: Raw | O8: Thresholded | P8: Error
A9: Channel Filling | B9: 2 | C9: 0 | D9: 0 | E9: =RC[-2]/R13C[-2] -> 0 | F9: 350 | G9: 280 | H9: 15 | I9: =RC[-2]/R13C[-2] -> 0.77562326869806097 | J9: =RC[-8]+RC[-4] -> 352 | K9: =RC[-8]+RC[-4] -> 280 | L9: =RC[-8]+RC[-4] -> 15 | M9: =RC[-2]/R13C[-2] -> 0.625 | N9: =RC[-8]-RC[-12] -> 348 | O9: =RC[-8]-RC[-12] -> 280 | P9: =SQRT(RC[-12]^2+RC[-8]^2) -> 15
A10: Channel Scour | B10: 100 | C10: 60 | D10: 10 | E10: =RC[-2]/R13C[-2] -> 0.68965517241379315 | F10: 5 | G10: 1 | H10: 1 | I10: =RC[-2]/R13C[-2] -> 2.7700831024930748E-3 | J10: =RC[-8]+RC[-4] -> 105 | K10: =RC[-8]+RC[-4] -> 61 | L10: =RC[-8]+RC[-4] -> 11 | M10: =RC[-2]/R13C[-2] -> 0.13616071428571427 | N10: =RC[-8]-RC[-12] -> -95 | O10: =RC[-8]-RC[-12] -> -59 | P10: =SQRT(RC[-12]^2+RC[-8]^2) -> 10.04987562112089
A11: Central Bar Development | B11: 5 | C11: 2 | D11: 1 | E11: =RC[-2]/R13C[-2] -> 2.2988505747126436E-2 | F11: 95 | G11: 60 | H11: 45 | I11: =RC[-2]/R13C[-2] -> 0.16620498614958448 | J11: =RC[-8]+RC[-4] -> 100 | K11: =RC[-8]+RC[-4] -> 62 | L11: =RC[-8]+RC[-4] -> 46 | M11: =RC[-2]/R13C[-2] -> 0.13839285714285715 | N11: =RC[-8]-RC[-12] -> 90 | O11: =RC[-8]-RC[-12] -> 58 | P11: =SQRT(RC[-12]^2+RC[-8]^2) -> 45.011109739707599
A12: Something Crazy | B12: 50 | C12: 25 | D12: 10 | E12: =RC[-2]/R13C[-2] -> 0.28735632183908044 | F12: 30 | G12: 20 | H12: 15 | I12: =RC[-2]/R13C[-2] -> 5.5401662049861494E-2 | J12: =RC[-8]+RC[-4] -> 80 | K12: =RC[-8]+RC[-4] -> 45 | L12: =RC[-8]+RC[-4] -> 25 | M12: =RC[-2]/R13C[-2] -> 0.10044642857142858 | N12: =RC[-8]-RC[-12] -> -20 | O12: =RC[-8]-RC[-12] -> -5 | P12: =SQRT(RC[-12]^2+RC[-8]^2) -> 18.027756377319946
A13: Total of All Compared | B13: =SUM(R[-4]C:R[-1]C) -> 157 | C13: =SUM(R[-4]C:R[-1]C) -> 87 | D13: =SUM(R[-4]C:R[-1]C) -> 21 | E13: =SUM(R[-4]C:R[-1]C) -> 1 | F13: =SUM(R[-4]C:R[-1]C) -> 480 | G13: =SUM(R[-4]C:R[-1]C) -> 361 | H13: =SUM(R[-4]C:R[-1]C) -> 76 | I13: =SUM(R[-4]C:R[-1]C) -> 1 | J13: =SUM(R[-4]C:R[-1]C) -> 637 | K13: =SUM(R[-4]C:R[-1]C) -> 448 | L13: =SUM(R[-4]C:R[-1]C) -> 97 | M13: =SUM(R[-4]C:R[-1]C) -> 1 | N13: =RC[-8]-RC[-12] -> 323 | O13: =RC[-8]-RC[-12] -> 274 | P13: =SQRT(RC[-12]^2+RC[-8]^2) -> 78.847954951285828
A14: VERTICAL AVERAGES
B15: Average Depth of Surface Lowering (m) | F15: Average Depth of Surface Raising (m) | J15: AOI Average Total Thickness of Difference (m) | N15: AOI Average Net Thickness Difference (m) | Q15: ADC Avg Total Thickness of Difference (m) | S15: ADC Average Net Thickness of Difference (m)
B16: Raw | C16: Thresholded | D16: Error | F16: Raw | G16: Thresholded | H16: Error | J16: Raw | K16: Thresholded | L16: Error | N16: Raw | O16: Thresholded | P16: Error | Q16: Thresholded | R16: Error | S16: Thresholded | T16: Error
A17: Channel Filling | B17: =R[-8]C/R[-13]C -> 0.4 | C17: =R[-8]C/R[-13]C -> 0 | D17: =R[-8]C/R[-13]C[-1] -> 0 | F17: =R[-8]C/R[-13]C -> 1.383399209486166 | G17: =R[-8]C/R[-13]C -> 1.5555555555555556 | H17: =R[-8]C/R[-13]C[-1] -> 8.3333333333333329E-2 | J17: =R[-8]C/R[-13]C[2] -> 1.3643410852713178 | K17: =R[-8]C/R[-13]C[1] -> 1.0852713178294573 | L17: =R[-8]C/R[-13]C -> 5.8139534883720929E-2 | N17: =R[-8]C/R[-13]C12 -> 1.3488372093023255 | O17: =R[-8]C/R[-13]C12 -> 1.0852713178294573 | P17: =R[-8]C/R[-13]C12 -> 5.8139534883720929E-2 | Q17: =R[-8]C[-6]/R[-13]C10 -> 1.5469613259668509 | R17: =R[-8]C[-6]/R[-13]C10 -> 8.2872928176795577E-2 | S17: =R[-8]C[-4]/R[-13]C10 -> 1.5469613259668509 | T17: =R[-8]C[-4]/R[-13]C10 -> 8.2872928176795577E-2
A18: Channel Scour | B18: =R[-8]C/#REF! -> #REF! | C18: =R[-8]C/#REF! -> #REF! | D18: =R[-8]C/#REF! -> #REF! | F18: =R[-8]C/#REF! -> #REF! | G18: =R[-8]C/#REF! -> #REF! | H18: =R[-8]C/#REF! -> #REF! | J18: =R[-8]C/#REF! -> #REF! | K18: =R[-8]C/#REF! -> #REF! | L18: =R[-8]C/#REF! -> #REF! | N18: =R[-8]C/#REF! -> #REF! | O18: =R[-8]C/#REF! -> #REF! | P18: =R[-8]C/#REF! -> #REF! | Q18: =R[-8]C[-6]/#REF! -> #REF! | R18: =R[-8]C[-6]/#REF! -> #REF! | S18: =R[-8]C[-4]/#REF! -> #REF! | T18: =R[-8]C[-4]/#REF! -> #REF!
A19: Central Bar Development | B19: =R[-8]C/#REF! -> #REF! | C19: =R[-8]C/#REF! -> #REF! | D19: =R[-8]C/#REF! -> #REF! | F19: =R[-8]C/#REF! -> #REF! | G19: =R[-8]C/#REF! -> #REF! | H19: =R[-8]C/#REF! -> #REF! | J19: =R[-8]C/#REF! -> #REF! | K19: =R[-8]C/#REF! -> #REF! | L19: =R[-8]C/#REF! -> #REF! | N19: =R[-8]C/#REF! -> #REF! | O19: =R[-8]C/#REF! -> #REF! | P19: =R[-8]C/#REF! -> #REF! | Q19: =R[-8]C[-6]/#REF! -> #REF! | R19: =R[-8]C[-6]/#REF! -> #REF! | S19: =R[-8]C[-4]/#REF! -> #REF! | T19: =R[-8]C[-4]/#REF! -> #REF!
A20: Something Crazy | B20: =R[-8]C/#REF! -> #REF! | C20: =R[-8]C/#REF! -> #REF! | D20: =R[-8]C/#REF! -> #REF! | F20: =R[-8]C/#REF! -> #REF! | G20: =R[-8]C/#REF! -> #REF! | H20: =R[-8]C/#REF! -> #REF! | J20: =R[-8]C/#REF! -> #REF! | K20: =R[-8]C/#REF! -> #REF! | L20: =R[-8]C/#REF! -> #REF! | N20: =R[-8]C/#REF! -> #REF! | O20: =R[-8]C/#REF! -> #REF! | P20: =R[-8]C/#REF! -> #REF! | Q20: =R[-8]C[-6]/#REF! -> #REF! | R20: =R[-8]C[-6]/#REF! -> #REF! | S20: =R[-8]C[-4]/#REF! -> #REF! | T20: =R[-8]C[-4]/#REF! -> #REF!
A21: Total of All Compared | B21: =R[-8]C/R[-16]C -> 31.4 | C21: =R[-8]C/R[-16]C -> 87 | D21: =R[-8]C/R[-16]C[-1] -> 21 | F21: =R[-8]C/R[-16]C -> 1.8972332015810276 | G21: =R[-8]C/R[-16]C -> 2.0055555555555555 | H21: =R[-8]C/R[-16]C[-1] -> 0.42222222222222222 | J21: =R[-8]C/R[-16]C[2] -> 2.4689922480620154 | K21: =R[-8]C/R[-16]C[1] -> 1.7364341085271318 | L21: =R[-8]C/R[-16]C -> 0.37596899224806202 | N21: =R[-8]C/R[-16]C12 -> 1.251937984496124 | O21: =R[-8]C/R[-16]C12 -> 1.0620155038759691 | P21: =R[-8]C/R[-16]C12 -> 0.3056122284933559 | Q21: =R[-8]C[-6]/R[-16]C10 -> 2.4751381215469612 | R21: =R[-8]C[-6]/R[-16]C10 -> 0.53591160220994472 | S21: =R[-8]C[-4]/R[-16]C10 -> 1.5138121546961325 | T21: =R[-8]C[-4]/R[-16]C10 -> 0.4356240605043416
A22: PERCENTAGES BY VOLUME
B23: Percent Elevation Lowering | F23: Percent Elevation Raising | J23: Percent Imbalance (departure from equilibrium) | L23: Net to Total Volume Ratio
B24: Raw | C24: Thresholded | F24: Raw | G24: Thresholded | J24: Raw | K24: Thresholded | L24: Raw | M24: Thresholded
A25: Channel Filling | B25: =R[-16]C/R[-16]C[8] -> 5.681818181818182E-3 | C25: =R[-16]C/R[-16]C[8] -> 0 | F25: =R[-16]C/R[-16]C[4] -> 0.99431818181818177 | G25: =R[-16]C/R[-16]C[4] -> 1 | J25: =R[-16]C[4]/(2*R[-16]C) -> 0.49431818181818182 | K25: =R[-16]C[4]/(2*R[-16]C) -> 0.5 | L25: =R[-16]C[2]/R[-16]C[-2] -> 0.98863636363636365 | M25: =R[-16]C[2]/R[-16]C[-2] -> 1
A26: Channel Scour | B26: =R[-16]C/R[-16]C[8] -> 0.95238095238095233 | C26: =R[-16]C/R[-16]C[8] -> 0.98360655737704916 | F26: =R[-16]C/R[-16]C[4] -> 4.7619047619047616E-2 | G26: =R[-16]C/R[-16]C[4] -> 1.6393442622950821E-2 | J26: =R[-16]C[4]/(2*R[-16]C) -> -0.45238095238095238 | K26: =R[-16]C[4]/(2*R[-16]C) -> -0.48360655737704916 | L26: =R[-16]C[2]/R[-16]C[-2] -> -0.90476190476190477 | M26: =R[-16]C[2]/R[-16]C[-2] -> -0.96721311475409832
A27: Central Bar Development | B27: =R[-16]C/R[-16]C[8] -> 0.05 | C27: =R[-16]C/R[-16]C[8] -> 3.2258064516129031E-2 | F27: =R[-16]C/R[-16]C[4] -> 0.95 | G27: =R[-16]C/R[-16]C[4] -> 0.967741935483871 | J27: =R[-16]C[4]/(2*R[-16]C) -> 0.45 | K27: =R[-16]C[4]/(2*R[-16]C) -> 0.46774193548387094 | L27: =R[-16]C[2]/R[-16]C[-2] -> 0.9 | M27: =R[-16]C[2]/R[-16]C[-2] -> 0.93548387096774188
A28: Something Crazy | B28: =R[-16]C/R[-16]C[8] -> 0.625 | C28: =R[-16]C/R[-16]C[8] -> 0.55555555555555558 | F28: =R[-16]C/R[-16]C[4] -> 0.375 | G28: =R[-16]C/R[-16]C[4] -> 0.44444444444444442 | J28: =R[-16]C[4]/(2*R[-16]C) -> -0.125 | K28: =R[-16]C[4]/(2*R[-16]C) -> -5.5555555555555552E-2 | L28: =R[-16]C[2]/R[-16]C[-2] -> -0.25 | M28: =R[-16]C[2]/R[-16]C[-2] -> -0.1111111111111111
A29: Total of All Compared | B29: =R[-16]C/R[-16]C[8] -> 0.24646781789638933 | C29: =R[-16]C/R[-16]C[8] -> 0.19419642857142858 | F29: =R[-16]C/R[-16]C[4] -> 0.75353218210361073 | G29: =R[-16]C/R[-16]C[4] -> 0.8058035714285714 | J29: =R[-16]C[4]/(2*R[-16]C) -> 0.25353218210361067 | K29: =R[-16]C[4]/(2*R[-16]C) -> 0.30580357142857145 | L29: =R[-16]C[2]/R[-16]C[-2] -> 0.50706436420722134 | M29: =R[-16]C[2]/R[-16]C[-2] -> 0.6116071428571429