Sheet: Sheet1
A1: Morphological Analysis
B2: ∑VE | E2: ∑VD | H2: ΔV | K2: Vin | L2: Vout | M2: Qb Out | N2: ΔV Cummulative
A3: Sub Reach | B3: m3 | E3: m3 | H3: m3 | K3: m3 | L3: m3 | M3: m3/day | N3: m3
A4: A | C4: ± | F4: ± | H4: =RC[-3]-RC[-6] -> 0 | I4: ± | J4: =SQRT((RC[-6]^2)+(RC[-3]^2)) -> 0 | K4: =9999+RC[-3] -> 9999 | L4: =-RC[-4]+RC[-1] -> 9999 | M4: =((1-R15C2)*RC[-1])/R16C2 -> 862.04970873786408 | N4: =RC[-6] -> 0
A5: B | C5: ± | F5: ± | H5: =RC[-3]-RC[-6] -> 0 | I5: ± | J5: =SQRT((RC[-6]^2)+(RC[-3]^2)) -> 0 | K5: =R[-1]C[1] -> 9999 | L5: =RC[-1]-RC[-4] -> 9999 | M5: =((1-R15C2)*RC[-1])/R16C2 -> 862.04970873786408 | N5: =R[-1]C[-6]+RC[-6] -> 0
A6: C | C6: ± | F6: ± | H6: =RC[-3]-RC[-6] -> 0 | I6: ± | J6: =SQRT((RC[-6]^2)+(RC[-3]^2)) -> 0 | K6: =R[-1]C[1] -> 9999 | L6: =RC[-1]-RC[-4] -> 9999 | M6: =((1-R15C2)*RC[-1])/R16C2 -> 862.04970873786408 | N6: =R[-1]C+RC[-6] -> 0
A7: D | C7: ± | F7: ± | H7: =RC[-3]-RC[-6] -> 0 | I7: ± | J7: =SQRT((RC[-6]^2)+(RC[-3]^2)) -> 0 | K7: =R[-1]C[1] -> 9999 | L7: =RC[-1]-RC[-4] -> 9999 | M7: =((1-R15C2)*RC[-1])/R16C2 -> 862.04970873786408 | N7: =R[-1]C+RC[-6] -> 0
A8: E | C8: ± | F8: ± | H8: =RC[-3]-RC[-6] -> 0 | I8: ± | J8: =SQRT((RC[-6]^2)+(RC[-3]^2)) -> 0 | K8: =R[-1]C[1] -> 9999 | L8: =RC[-1]-RC[-4] -> 9999 | M8: =((1-R15C2)*RC[-1])/R16C2 -> 862.04970873786408 | N8: =R[-1]C+RC[-6] -> 0
A9: F | C9: ± | F9: ± | H9: =RC[-3]-RC[-6] -> 0 | I9: ± | J9: =SQRT((RC[-6]^2)+(RC[-3]^2)) -> 0 | K9: =R[-1]C[1] -> 9999 | L9: =RC[-1]-RC[-4] -> 9999 | M9: =((1-R15C2)*RC[-1])/R16C2 -> 862.04970873786408 | N9: =R[-1]C+RC[-6] -> 0
A10: G | C10: ± | F10: ± | H10: =RC[-3]-RC[-6] -> 0 | I10: ± | J10: =SQRT((RC[-6]^2)+(RC[-3]^2)) -> 0 | K10: =R[-1]C[1] -> 9999 | L10: =RC[-1]-RC[-4] -> 9999 | M10: =((1-R15C2)*RC[-1])/R16C2 -> 862.04970873786408 | N10: =R[-1]C+RC[-6] -> 0
A11: H | C11: ± | F11: ± | H11: =RC[-3]-RC[-6] -> 0 | I11: ± | J11: =SQRT((RC[-6]^2)+(RC[-3]^2)) -> 0 | K11: =R[-1]C[1] -> 9999 | L11: =RC[-1]-RC[-4] -> 9999 | M11: =((1-R15C2)*RC[-1])/R16C2 -> 862.04970873786408 | N11: =R[-1]C+RC[-6] -> 0
A12: I | C12: ± | F12: ± | H12: =RC[-3]-RC[-6] -> 0 | I12: ± | J12: =SQRT((RC[-6]^2)+(RC[-3]^2)) -> 0 | K12: =R[-1]C[1] -> 9999 | L12: =RC[-1]-RC[-4] -> 9999 | M12: =((1-R15C2)*RC[-1])/R16C2 -> 862.04970873786408 | N12: =R[-1]C+RC[-6] -> 0
A13: Reach Total | B13: =SUM(R[-9]C:R[-1]C) -> 0 | C13: ± | D13: =SUM(R[-9]C:R[-1]C) -> 0 | E13: =SUM(R[-9]C:R[-1]C) -> 0 | F13: ± | G13: =SUM(R[-9]C:R[-1]C) -> 0 | H13: =SUM(R[-9]C:R[-1]C) -> 0 | I13: ± | J13: =SUM(R[-9]C:R[-1]C) -> 0 | K13: =R[-9]C -> 9999 | L13: =R[-1]C -> 9999 | M13: =((1-R15C2)*RC[-1])/R16C2 -> 862.04970873786408 | N13: =R[-1]C -> 0
B15: 0.26 | C15: Porosity (%)
B16: =206/24 -> 8.5833333333333339 | C16: Competent flow duration (days)